{
  "version": 1,
  "scannerVersion": "1.1.0",
  "generatedAt": "2026-06-24T06:36:31.492Z",
  "root": "/Users/vcsm/Desktop/VCSM",
  "scanDurationMs": 7583,
  "confidence": "HIGH",
  "featureCount": 74,
  "data": {
    "version": 1,
    "generatedAt": "2026-06-24T06:36:26.850Z",
    "root": "/Users/vcsm/Desktop/VCSM",
    "features": [
      {
        "feature": "app",
        "app": "Traffic",
        "appId": "Traffic",
        "root": "apps/Traffic",
        "kind": "platform-area",
        "path": "apps/Traffic/src/app",
        "sourceFileCount": 69,
        "layerCounts": {
          "module": 69
        },
        "tests": 0,
        "status": "active"
      },
      {
        "feature": "answers",
        "app": "Traffic",
        "appId": "Traffic",
        "root": "apps/Traffic",
        "kind": "feature",
        "path": "apps/Traffic/src/features/answers",
        "sourceFileCount": 46,
        "layerCounts": {
          "adapter": 1,
          "component": 16,
          "controller": 3,
          "dal": 9,
          "hook": 5,
          "model": 9,
          "screen": 3
        },
        "tests": 0,
        "status": "active"
      },
      {
        "feature": "categories",
        "app": "Traffic",
        "appId": "Traffic",
        "root": "apps/Traffic",
        "kind": "feature",
        "path": "apps/Traffic/src/features/categories",
        "sourceFileCount": 2,
        "layerCounts": {
          "adapter": 1,
          "component": 1
        },
        "tests": 0,
        "status": "active"
      },
      {
        "feature": "conversion",
        "app": "Traffic",
        "appId": "Traffic",
        "root": "apps/Traffic",
        "kind": "feature",
        "path": "apps/Traffic/src/features/conversion",
        "sourceFileCount": 10,
        "layerCounts": {
          "adapter": 1,
          "component": 4,
          "controller": 1,
          "dal": 1,
          "hook": 1,
          "module": 1,
          "model": 1
        },
        "tests": 0,
        "status": "active"
      },
      {
        "feature": "directories",
        "app": "Traffic",
        "appId": "Traffic",
        "root": "apps/Traffic",
        "kind": "feature",
        "path": "apps/Traffic/src/features/directories",
        "sourceFileCount": 12,
        "layerCounts": {
          "adapter": 1,
          "component": 7,
          "dal": 1,
          "module": 3
        },
        "tests": 0,
        "status": "active"
      },
      {
        "feature": "home",
        "app": "Traffic",
        "appId": "Traffic",
        "root": "apps/Traffic",
        "kind": "feature",
        "path": "apps/Traffic/src/features/home",
        "sourceFileCount": 14,
        "layerCounts": {
          "adapter": 1,
          "component": 13
        },
        "tests": 0,
        "status": "active"
      },
      {
        "feature": "legal",
        "app": "Traffic",
        "appId": "Traffic",
        "root": "apps/Traffic",
        "kind": "feature",
        "path": "apps/Traffic/src/features/legal",
        "sourceFileCount": 4,
        "layerCounts": {
          "adapter": 1,
          "screen": 3
        },
        "tests": 0,
        "status": "active"
      },
      {
        "feature": "providers",
        "app": "Traffic",
        "appId": "Traffic",
        "root": "apps/Traffic",
        "kind": "feature",
        "path": "apps/Traffic/src/features/providers",
        "sourceFileCount": 15,
        "layerCounts": {
          "adapter": 1,
          "component": 10,
          "dal": 1,
          "module": 3
        },
        "tests": 0,
        "status": "active"
      },
      {
        "feature": "reviews",
        "app": "Traffic",
        "appId": "Traffic",
        "root": "apps/Traffic",
        "kind": "feature",
        "path": "apps/Traffic/src/features/reviews",
        "sourceFileCount": 2,
        "layerCounts": {
          "adapter": 1,
          "component": 1
        },
        "tests": 0,
        "status": "active"
      },
      {
        "feature": "search",
        "app": "Traffic",
        "appId": "Traffic",
        "root": "apps/Traffic",
        "kind": "feature",
        "path": "apps/Traffic/src/features/search",
        "sourceFileCount": 3,
        "layerCounts": {
          "component": 1,
          "dal": 1,
          "module": 1
        },
        "tests": 0,
        "status": "active"
      },
      {
        "feature": "shared",
        "app": "Traffic",
        "appId": "Traffic",
        "root": "apps/Traffic",
        "kind": "shared",
        "path": "apps/Traffic/src/shared",
        "sourceFileCount": 17,
        "layerCounts": {
          "component": 17
        },
        "tests": 0,
        "status": "active"
      },
      {
        "feature": "styles",
        "app": "Traffic",
        "appId": "Traffic",
        "root": "apps/Traffic",
        "kind": "styles",
        "path": "apps/Traffic/src/styles",
        "sourceFileCount": 0,
        "layerCounts": {},
        "tests": 0,
        "status": "active"
      },
      {
        "feature": "app",
        "app": "VCSM",
        "appId": "VCSM",
        "root": "apps/VCSM",
        "kind": "platform-area",
        "path": "apps/VCSM/src/app",
        "sourceFileCount": 39,
        "layerCounts": {
          "module": 33,
          "component": 3,
          "hook": 3
        },
        "tests": 0,
        "status": "active"
      },
      {
        "feature": "actors",
        "app": "VCSM",
        "appId": "VCSM",
        "root": "apps/VCSM",
        "kind": "feature",
        "path": "apps/VCSM/src/features/actors",
        "sourceFileCount": 4,
        "layerCounts": {
          "adapter": 1,
          "controller": 1,
          "dal": 1,
          "model": 1
        },
        "tests": 0,
        "status": "active"
      },
      {
        "feature": "ads",
        "app": "VCSM",
        "appId": "VCSM",
        "root": "apps/VCSM",
        "kind": "feature",
        "path": "apps/VCSM/src/features/ads",
        "sourceFileCount": 18,
        "layerCounts": {
          "adapter": 2,
          "module": 6,
          "dal": 1,
          "hook": 2,
          "model": 2,
          "screen": 2,
          "component": 3
        },
        "tests": 0,
        "status": "active"
      },
      {
        "feature": "auth",
        "app": "VCSM",
        "appId": "VCSM",
        "root": "apps/VCSM",
        "kind": "feature",
        "path": "apps/VCSM/src/features/auth",
        "sourceFileCount": 67,
        "layerCounts": {
          "adapter": 2,
          "controller": 18,
          "dal": 14,
          "hook": 13,
          "screen": 9,
          "component": 2,
          "model": 7,
          "style": 2
        },
        "tests": 5,
        "status": "active"
      },
      {
        "feature": "authorization",
        "app": "VCSM",
        "appId": "VCSM",
        "root": "apps/VCSM",
        "kind": "feature",
        "path": "apps/VCSM/src/features/authorization",
        "sourceFileCount": 8,
        "layerCounts": {
          "adapter": 1,
          "controller": 4,
          "dal": 2,
          "model": 1
        },
        "tests": 1,
        "status": "active"
      },
      {
        "feature": "block",
        "app": "VCSM",
        "appId": "VCSM",
        "root": "apps/VCSM",
        "kind": "feature",
        "path": "apps/VCSM/src/features/block",
        "sourceFileCount": 18,
        "layerCounts": {
          "adapter": 4,
          "controller": 3,
          "dal": 3,
          "module": 2,
          "hook": 3,
          "component": 3
        },
        "tests": 0,
        "status": "active"
      },
      {
        "feature": "booking",
        "app": "VCSM",
        "appId": "VCSM",
        "root": "apps/VCSM",
        "kind": "feature",
        "path": "apps/VCSM/src/features/booking",
        "sourceFileCount": 65,
        "layerCounts": {
          "adapter": 1,
          "controller": 13,
          "dal": 23,
          "hook": 16,
          "model": 11,
          "module": 1
        },
        "tests": 0,
        "status": "active"
      },
      {
        "feature": "CentralFeed",
        "app": "VCSM",
        "appId": "VCSM",
        "root": "apps/VCSM",
        "kind": "feature",
        "path": "apps/VCSM/src/features/CentralFeed",
        "sourceFileCount": 46,
        "layerCounts": {
          "adapter": 2,
          "component": 4,
          "controller": 4,
          "dal": 15,
          "hook": 8,
          "model": 8,
          "module": 2,
          "screen": 3
        },
        "tests": 0,
        "status": "active"
      },
      {
        "feature": "chat",
        "app": "VCSM",
        "appId": "VCSM",
        "root": "apps/VCSM",
        "kind": "feature",
        "path": "apps/VCSM/src/features/chat",
        "sourceFileCount": 66,
        "layerCounts": {
          "adapter": 2,
          "component": 12,
          "controller": 2,
          "dal": 2,
          "hook": 23,
          "module": 12,
          "screen": 11,
          "model": 1,
          "state": 1
        },
        "tests": 0,
        "status": "active"
      },
      {
        "feature": "claim",
        "app": "VCSM",
        "appId": "VCSM",
        "root": "apps/VCSM",
        "kind": "feature",
        "path": "apps/VCSM/src/features/claim",
        "sourceFileCount": 14,
        "layerCounts": {
          "adapter": 1,
          "component": 6,
          "controller": 2,
          "dal": 2,
          "hook": 1,
          "model": 1,
          "screen": 1
        },
        "tests": 0,
        "status": "active"
      },
      {
        "feature": "claimOnboarding",
        "app": "VCSM",
        "appId": "VCSM",
        "root": "apps/VCSM",
        "kind": "feature",
        "path": "apps/VCSM/src/features/claimOnboarding",
        "sourceFileCount": 10,
        "layerCounts": {
          "adapter": 1,
          "component": 3,
          "controller": 1,
          "dal": 1,
          "hook": 1,